{
  "run_id": "run-20261002-170239-dtxn",
  "phase": "progression_plan",
  "produced_by": "progression-planner",
  "version": 3,
  "status": "draft",
  "created_at": "2026-10-02T19:00:00+00:00",
  "payload": {
    "progression_strategy": "Double progression within each exercise's rep range (per research.json finding for beginner fat-loss training: moderate rep ranges, 1-3 RIR, dumbbell loads capped around 20 kg). Week 1 starts one set lighter on 3-set exercises, weeks 2-7 run the prescribed sets while RIR tightens from 3 to 1-2, and week 8 is a lighter consolidation/deload. Once rep-range tops are reached, add load in small steps, or, when dumbbells cap out, add tempo, pauses, or shorter rest. Knee flexion stays shallow-to-moderate throughout. If you feel unusually fatigued or sore around weeks 4-5, take an easier week (drop to 2 sets per exercise at about 3 RIR) before continuing.",
    "deload_weeks": [
      8
    ],
    "weeks": [
      {
        "week_number": 1,
        "sessions": [
          {
            "session_id": "day1",
            "exercises": [
              {
                "exercise_id": "db_floor_press",
                "sets": 2,
                "reps": "8-12",
                "load_guidance": "Choose a dumbbell you can lift for the bottom of the rep range with the target RIR. Double progression: once you hit the top of the range on all sets for 2 consecutive sessions with good form, increase load ~2.5-5% (smallest jump available; dumbbells are capped at about 20 kg, so when the cap is reached add reps, slow the 3-sec lowering, or shorten rest instead). Weeks 1-2: learn the movement and stay at the lower end of the range.",
                "intensity": "3 RIR (about 3 reps left)"
              },
              {
                "exercise_id": "db_romanian_deadlift",
                "sets": 2,
                "reps": "10-15",
                "load_guidance": "Choose a dumbbell you can lift for the bottom of the rep range with the target RIR. Double progression: once you hit the top of the range on all sets for 2 consecutive sessions with good form, increase load ~2.5-5% (smallest jump available; dumbbells are capped at about 20 kg, so when the cap is reached add reps, slow the 3-sec lowering, or shorten rest instead). Weeks 1-2: learn the movement and stay at the lower end of the range.",
                "intensity": "3 RIR (about 3 reps left)"
              },
              {
                "exercise_id": "bw_squat",
                "sets": 2,
                "reps": "10-15",
                "load_guidance": "Bodyweight: progress by adding reps up to the top of the range, then slow the lowering (3 sec) or pause 1 sec at the hardest point, or move to a harder variation only when form stays clean. Weeks 1-2: learn the movement and stay at the lower end of the range. Keep knee bend shallow-to-moderate (box-limited, pain-free); stop if knee pain appears.",
                "intensity": "3 RIR (about 3 reps left)"
              },
              {
                "exercise_id": "db_row",
                "sets": 2,
                "reps": "8-12",
                "load_guidance": "Choose a dumbbell you can lift for the bottom of the rep range with the target RIR. Double progression: once you hit the top of the range on all sets for 2 consecutive sessions with good form, increase load ~2.5-5% (smallest jump available; dumbbells are capped at about 20 kg, so when the cap is reached add reps, slow the 3-sec lowering, or shorten rest instead). Weeks 1-2: learn the movement and stay at the lower end of the range.",
                "intensity": "3 RIR (about 3 reps left)"
              },
              {
                "exercise_id": "bw_incline_pushup",
                "sets": 2,
                "reps": "8-15",
                "load_guidance": "Bodyweight: progress by adding reps up to the top of the range, then slow the lowering (3 sec) or pause 1 sec at the hardest point, or move to a harder variation only when form stays clean. Weeks 1-2: learn the movement and stay at the lower end of the range.",
                "intensity": "3 RIR (about 3 reps left)"
              },
              {
                "exercise_id": "bw_plank",
                "sets": 2,
                "reps": "20-40 sec",
                "load_guidance": "Hold time: add about 5 seconds per set once you complete all sets with good form for 2 consecutive sessions; stay at the shorter end in weeks 1-2. Weeks 1-2: learn the movement and stay at the lower end of the range.",
                "intensity": "3 RIR (about 3 reps left)"
              }
            ]
          },
          {
            "session_id": "day2",
            "exercises": [
              {
                "exercise_id": "db_row",
                "sets": 2,
                "reps": "10-15 (slow 3-sec lowering)",
                "load_guidance": "Choose a dumbbell you can lift for the bottom of the rep range with the target RIR. Double progression: once you hit the top of the range on all sets for 2 consecutive sessions with good form, increase load ~2.5-5% (smallest jump available; dumbbells are capped at about 20 kg, so when the cap is reached add reps, slow the 3-sec lowering, or shorten rest instead). Weeks 1-2: learn the movement and stay at the lower end of the range.",
                "intensity": "3 RIR (about 3 reps left)"
              },
              {
                "exercise_id": "bw_pushup",
                "sets": 2,
                "reps": "6-12",
                "load_guidance": "Bodyweight: progress by adding reps up to the top of the range, then slow the lowering (3 sec) or pause 1 sec at the hardest point, or move to a harder variation only when form stays clean. Weeks 1-2: learn the movement and stay at the lower end of the range.",
                "intensity": "3 RIR (about 3 reps left)"
              },
              {
                "exercise_id": "bw_single_leg_glute_bridge",
                "sets": 2,
                "reps": "8-12 per leg",
                "load_guidance": "Bodyweight: progress by adding reps up to the top of the range, then slow the lowering (3 sec) or pause 1 sec at the hardest point, or move to a harder variation only when form stays clean. Weeks 1-2: learn the movement and stay at the lower end of the range.",
                "intensity": "3 RIR (about 3 reps left)"
              },
              {
                "exercise_id": "bw_squat",
                "sets": 2,
                "reps": "10-15 (shallow, box-limited)",
                "load_guidance": "Bodyweight: progress by adding reps up to the top of the range, then slow the lowering (3 sec) or pause 1 sec at the hardest point, or move to a harder variation only when form stays clean. Weeks 1-2: learn the movement and stay at the lower end of the range. Keep knee bend shallow-to-moderate (box-limited, pain-free); stop if knee pain appears.",
                "intensity": "3 RIR (about 3 reps left)"
              },
              {
                "exercise_id": "db_farmers_carry",
                "sets": 2,
                "reps": "30-40 sec",
                "load_guidance": "Hold time: add about 5 seconds per set once you complete all sets with good form for 2 consecutive sessions; stay at the shorter end in weeks 1-2. Weeks 1-2: learn the movement and stay at the lower end of the range.",
                "intensity": "3 RIR (about 3 reps left)"
              },
              {
                "exercise_id": "bw_side_plank",
                "sets": 2,
                "reps": "15-30 sec per side",
                "load_guidance": "Hold time: add about 5 seconds per set once you complete all sets with good form for 2 consecutive sessions; stay at the shorter end in weeks 1-2. Weeks 1-2: learn the movement and stay at the lower end of the range.",
                "intensity": "3 RIR (about 3 reps left)"
              }
            ]
          },
          {
            "session_id": "day3",
            "exercises": [
              {
                "exercise_id": "db_floor_press",
                "sets": 2,
                "reps": "10-15",
                "load_guidance": "Choose a dumbbell you can lift for the bottom of the rep range with the target RIR. Double progression: once you hit the top of the range on all sets for 2 consecutive sessions with good form, increase load ~2.5-5% (smallest jump available; dumbbells are capped at about 20 kg, so when the cap is reached add reps, slow the 3-sec lowering, or shorten rest instead). Weeks 1-2: learn the movement and stay at the lower end of the range.",
                "intensity": "3 RIR (about 3 reps left)"
              },
              {
                "exercise_id": "db_row",
                "sets": 2,
                "reps": "12-15",
                "load_guidance": "Choose a dumbbell you can lift for the bottom of the rep range with the target RIR. Double progression: once you hit the top of the range on all sets for 2 consecutive sessions with good form, increase load ~2.5-5% (smallest jump available; dumbbells are capped at about 20 kg, so when the cap is reached add reps, slow the 3-sec lowering, or shorten rest instead). Weeks 1-2: learn the movement and stay at the lower end of the range.",
                "intensity": "3 RIR (about 3 reps left)"
              },
              {
                "exercise_id": "bw_squat",
                "sets": 2,
                "reps": "12-15",
                "load_guidance": "Bodyweight: progress by adding reps up to the top of the range, then slow the lowering (3 sec) or pause 1 sec at the hardest point, or move to a harder variation only when form stays clean. Weeks 1-2: learn the movement and stay at the lower end of the range. Keep knee bend shallow-to-moderate (box-limited, pain-free); stop if knee pain appears.",
                "intensity": "3 RIR (about 3 reps left)"
              },
              {